{
  "$schema":"https://json-schema.org/draft/2020-12/schema","$id":"factory-runner-aggregate/v4","type":"object","additionalProperties":false,"required":["schema","campaign_id","readiness_nonce","commit","tree","environment_blob","runners"],
  "properties":{"schema":{"const":"factory-runner-aggregate/v4"},"campaign_id":{"$ref":"#/$defs/id"},"readiness_nonce":{"$ref":"#/$defs/sha256"},"commit":{"$ref":"#/$defs/sha1"},"tree":{"$ref":"#/$defs/sha1"},"environment_blob":{"$ref":"#/$defs/sha1"},"runners":{"type":"array","maxItems":64,"items":{"type":"object","additionalProperties":false,"required":["name","manifest","manifest_sha256","capabilities","artifact_manifest_sha256","artifact_count","artifact_bytes","signer"],"properties":{"name":{"$ref":"#/$defs/id"},"manifest":{"type":"string","pattern":"^\\.factory-state/runner-evidence/"},"manifest_sha256":{"$ref":"#/$defs/sha256"},"capabilities":{"type":"array","minItems":1,"uniqueItems":true,"items":{"$ref":"#/$defs/id"}},"artifact_manifest_sha256":{"$ref":"#/$defs/sha256"},"artifact_count":{"type":"integer","minimum":0,"maximum":64},"artifact_bytes":{"type":"integer","minimum":0,"maximum":50331648},"signer":{"type":"object","additionalProperties":false,"required":["principal","key_sha256","algorithm","signature_sha256"],"properties":{"principal":{"$ref":"#/$defs/id"},"key_sha256":{"$ref":"#/$defs/sha256"},"algorithm":{"const":"ssh-ed25519"},"signature_sha256":{"$ref":"#/$defs/sha256"}}}}}}},
  "$defs":{"id":{"type":"string","pattern":"^[a-z0-9](?:[a-z0-9._-]{0,62}[a-z0-9])?$"},"sha1":{"type":"string","pattern":"^[0-9a-f]{40}$"},"sha256":{"type":"string","pattern":"^[0-9a-f]{64}$"}}
}
